<!ELEMENT CourseOfferings (Department)*>
<!ELEMENT Department (#PCDATA|Course+) >
<!ELEMENT Course (Name, Instructor, Enrollment)>
<!ELEMENT Name (#PCDATA)>
<!ELEMENT Instructor (#PCDATA)>
<!ELEMENT Enrollment (Max, Current)>
<!ELEMENT Max (#PCDATA)>
<!ELEMENT Current (#PCDATA)>